{
  "compression": null,
  "container_format": "single_csv",
  "ordering": "repository_url, relative_path, content_sha256",
  "partitions": [
    {
      "path": "contributions.csv",
      "repository_url": null,
      "row_count": 24,
      "sha256": null
    }
  ],
  "row_contract_version": "1.5.0",
  "row_count": 24,
  "selection_evidence": {
    "decision": "row count is within the single-file threshold",
    "observed_row_count": 24,
    "single_file_row_threshold": 50000
  }
}
